ID,Data_Text,Result
2159,ผู้รักษาโรคนัดวันนี้มารับยา,หมอนัด
2160,ผู้รักษาโรคนัดวันนี้มาฉีดยา,หมอนัด
2161,ผู้รักษาโรคนัด,หมอนัด
2162,มาพบผู้รักษาโรควันนี้,หมอนัด
2163,มาพบผู้รักษาโรควันนี้จะต้องรับการรักษา,หมอนัด
2164,มาพบผู้รักษาโรควันนี้มารับยา,หมอนัด
2165,มาพบผู้รักษาโรควันนี้มาฉีดยา,หมอนัด
2166,มาพบผู้รักษาโรค,หมอนัด
2167,ผู้รักษาโรคขอพบวันนี้,หมอนัด
2168,ผู้รักษาโรคขอพบวันนี้จะต้องรับการรักษา,หมอนัด
2169,ผู้รักษาโรคขอพบวันนี้มารับยา,หมอนัด
2170,ผู้รักษาโรคขอพบวันนี้มาฉีดยา,หมอนัด
2171,ผู้รักษาโรคขอพบ,หมอนัด
2172,ผมมาหาหมอวันนี้,หมอนัด
2173,ผมมาหาหมอวันนี้จะต้องรับการรักษา,หมอนัด
2174,ผมมาหาหมอวันนี้มารับยา,หมอนัด
2175,ผมมาหาหมอวันนี้มาฉีดยา,หมอนัด
2176,ผมมาหาหมอ,หมอนัด
2177,ผมหมอนัดวันนี้,หมอนัด
2178,ผมหมอนัดวันนี้จะต้องรับการรักษา,หมอนัด
2179,ผมหมอนัดวันนี้มารับยา,หมอนัด
2180,ผมหมอนัดวันนี้มาฉีดยา,หมอนัด
2181,ผมหมอนัด,หมอนัด
2182,ผมหมอเรียกมาวันนี้,หมอนัด
2183,ผมหมอเรียกมาวันนี้จะต้องรับการรักษา,หมอนัด
2184,ผมหมอเรียกมาวันนี้มารับยา,หมอนัด
2185,ผมหมอเรียกมาวันนี้มาฉีดยา,หมอนัด
2186,ผมหมอเรียกมา,หมอนัด
2187,ผมมาพบหมอวันนี้,หมอนัด
2188,ผมมาพบหมอวันนี้จะต้องรับการรักษา,หมอนัด
2189,ผมมาพบหมอวันนี้มารับยา,หมอนัด
2190,ผมมาพบหมอวันนี้มาฉีดยา,หมอนัด
2191,ผมมาพบหมอ,หมอนัด
2192,ผมมาพบปะกับหมอวันนี้,หมอนัด
2193,ผมมาพบปะกับหมอวันนี้จะต้องรับการรักษา,หมอนัด
2194,ผมมาพบปะกับหมอวันนี้มารับยา,หมอนัด
2195,ผมมาพบปะกับหมอวันนี้มาฉีดยา,หมอนัด
2196,ผมมาพบปะกับหมอ,หมอนัด
2197,ผมหมอนัดหมายมาวันนี้,หมอนัด
2198,ผมหมอนัดหมายมาวันนี้จะต้องรับการรักษา,หมอนัด
2199,ผมหมอนัดหมายมาวันนี้มารับยา,หมอนัด
2200,ผมหมอนัดหมายมาวันนี้มาฉีดยา,หมอนัด
2201,ผมหมอนัดหมายมา,หมอนัด
2202,ผมหมอนัดพบวันนี้,หมอนัด
2203,ผมหมอนัดพบวันนี้จะต้องรับการรักษา,หมอนัด
2204,ผมหมอนัดพบวันนี้มารับยา,หมอนัด
2205,ผมหมอนัดพบวันนี้มาฉีดยา,หมอนัด
2206,ผมหมอนัดพบ,หมอนัด
2207,ผมแพทย์นัดพบวันนี้,หมอนัด
2208,ผมแพทย์นัดพบวันนี้จะต้องรับการรักษา,หมอนัด
2209,ผมแพทย์นัดพบวันนี้มารับยา,หมอนัด
2210,ผมแพทย์นัดพบวันนี้มาฉีดยา,หมอนัด
2211,ผมแพทย์นัดพบ,หมอนัด
2212,ผมมาพบปะกับแพทย์วันนี้,หมอนัด
2213,ผมมาพบปะกับแพทย์วันนี้จะต้องรับการรักษา,หมอนัด
2214,ผมมาพบปะกับแพทย์วันนี้มารับยา,หมอนัด
2215,ผมมาพบปะกับแพทย์วันนี้มาฉีดยา,หมอนัด
2216,ผมมาพบปะกับแพทย์,หมอนัด
2217,ผมแพทย์เรียกมาวันนี้,หมอนัด
2218,ผมแพทย์เรียกมาวันนี้จะต้องรับการรักษา,หมอนัด
2219,ผมแพทย์เรียกมาวันนี้มารับยา,หมอนัด
2220,ผมแพทย์เรียกมาวันนี้มาฉีดยา,หมอนัด
2221,ผมแพทย์เรียกมา,หมอนัด
2222,ผมแพทย์นัดหมายมาวันนี้,หมอนัด
2223,ผมแพทย์นัดหมายมาวันนี้จะต้องรับการรักษา,หมอนัด
2224,ผมแพทย์นัดหมายมาวันนี้มารับยา,หมอนัด
2225,ผมแพทย์นัดหมายมาวันนี้มาฉีดยา,หมอนัด
2226,ผมแพทย์นัดหมายมา,หมอนัด
2227,ผมแพทย์นัดมาวันนี้,หมอนัด
2228,ผมแพทย์นัดมาวันนี้จะต้องรับการรักษา,หมอนัด
2229,ผมแพทย์นัดมาวันนี้มารับยา,หมอนัด
2230,ผมแพทย์นัดมาวันนี้มาฉีดยา,หมอนัด
2231,ผมแพทย์นัดมา,หมอนัด
2232,ผมแพทย์นัดวันนี้,หมอนัด
2233,ผมแพทย์นัดวันนี้จะต้องรับการรักษา,หมอนัด
2234,ผมแพทย์นัดวันนี้มารับยา,หมอนัด
2235,ผมแพทย์นัดวันนี้มาฉีดยา,หมอนัด
2236,ผมแพทย์นัด,หมอนัด
2237,ผมมาพบแพทย์วันนี้,หมอนัด
2238,ผมมาพบแพทย์วันนี้จะต้องรับการรักษา,หมอนัด
2239,ผมมาพบแพทย์วันนี้มารับยา,หมอนัด
2240,ผมมาพบแพทย์วันนี้มาฉีดยา,หมอนัด
2241,ผมมาพบแพทย์,หมอนัด
2242,ผมแพทย์ขอพบวันนี้,หมอนัด
2243,ผมแพทย์ขอพบวันนี้จะต้องรับการรักษา,หมอนัด
2244,ผมแพทย์ขอพบวันนี้มารับยา,หมอนัด
2245,ผมแพทย์ขอพบวันนี้มาฉีดยา,หมอนัด
2246,ผมแพทย์ขอพบ,หมอนัด
2247,ผมมาหาผู้รักษาวันนี้,หมอนัด
2248,ผมมาหาผู้รักษาวันนี้จะต้องรับการรักษา,หมอนัด
2249,ผมมาหาผู้รักษาวันนี้มารับยา,หมอนัด
2250,ผมมาหาผู้รักษาวันนี้มาฉีดยา,หมอนัด
2251,ผมมาหาผู้รักษา,หมอนัด
2252,ผมผู้รักษานัดวันนี้,หมอนัด
2253,ผมผู้รักษานัดวันนี้จะต้องรับการรักษา,หมอนัด
2254,ผมผู้รักษานัดวันนี้มารับยา,หมอนัด
2255,ผมผู้รักษานัดวันนี้มาฉีดยา,หมอนัด
2256,ผมผู้รักษานัด,หมอนัด
2257,ผมผู้รักษาเรียกมาวันนี้,หมอนัด
2258,ผมผู้รักษาเรียกมาวันนี้จะต้องรับการรักษา,หมอนัด
2259,ผมผู้รักษาเรียกมาวันนี้มารับยา,หมอนัด
2260,ผมผู้รักษาเรียกมาวันนี้มาฉีดยา,หมอนัด
2261,ผมผู้รักษาเรียกมา,หมอนัด
2262,ผมมาพบผู้รักษาวันนี้,หมอนัด
2263,ผมมาพบผู้รักษาวันนี้จะต้องรับการรักษา,หมอนัด
2264,ผมมาพบผู้รักษาวันนี้มารับยา,หมอนัด
2265,ผมมาพบผู้รักษาวันนี้มาฉีดยา,หมอนัด
2266,ผมมาพบผู้รักษา,หมอนัด
2267,ผมมาพบปะกับผู้รักษาวันนี้,หมอนัด
2268,ผมมาพบปะกับผู้รักษาวันนี้จะต้องรับการรักษา,หมอนัด
2269,ผมมาพบปะกับผู้รักษาวันนี้มารับยา,หมอนัด
2270,ผมมาพบปะกับผู้รักษาวันนี้มาฉีดยา,หมอนัด
2271,ผมมาพบปะกับผู้รักษา,หมอนัด
2272,ผมผู้รักษานัดหมายมาวันนี้,หมอนัด
2273,ผมผู้รักษานัดหมายมาวันนี้จะต้องรับการรักษา,หมอนัด
2274,ผมผู้รักษานัดหมายมาวันนี้มารับยา,หมอนัด
2275,ผมผู้รักษานัดหมายมาวันนี้มาฉีดยา,หมอนัด
2276,ผมผู้รักษานัดหมายมา,หมอนัด
2277,ผมผู้รักษานัดพบวันนี้,หมอนัด
2278,ผมผู้รักษานัดพบวันนี้จะต้องรับการรักษา,หมอนัด
2279,ผมผู้รักษานัดพบวันนี้มารับยา,หมอนัด
2280,ผมผู้รักษานัดพบวันนี้มาฉีดยา,หมอนัด
2281,ผมผู้รักษานัดพบ,หมอนัด
2282,ผมมาหาผู้เยียวยาวันนี้,หมอนัด
2283,ผมมาหาผู้เยียวยาวันนี้จะต้องรับการรักษา,หมอนัด
2284,ผมมาหาผู้เยียวยาวันนี้มารับยา,หมอนัด
2285,ผมมาหาผู้เยียวยาวันนี้มาฉีดยา,หมอนัด
2286,ผมมาหาผู้เยียวยา,หมอนัด
2287,ผมผู้เยียวยานัดวันนี้,หมอนัด
2288,ผมผู้เยียวยานัดวันนี้จะต้องรับการรักษา,หมอนัด
2289,ผมผู้เยียวยานัดวันนี้มารับยา,หมอนัด
2290,ผมผู้เยียวยานัดวันนี้มาฉีดยา,หมอนัด
2291,ผมผู้เยียวยานัด,หมอนัด
2292,ผมผู้เยียวยาเรียกมาวันนี้,หมอนัด
2293,ผมผู้เยียวยาเรียกมาวันนี้จะต้องรับการรักษา,หมอนัด
2294,ผมผู้เยียวยาเรียกมาวันนี้มารับยา,หมอนัด
2295,ผมผู้เยียวยาเรียกมาวันนี้มาฉีดยา,หมอนัด
2296,ผมผู้เยียวยาเรียกมา,หมอนัด
2297,ผมมาพบผู้เยียวยาวันนี้,หมอนัด
2298,ผมมาพบผู้เยียวยาวันนี้จะต้องรับการรักษา,หมอนัด
2299,ผมมาพบผู้เยียวยาวันนี้มารับยา,หมอนัด
2300,ผมมาพบผู้เยียวยาวันนี้มาฉีดยา,หมอนัด
2301,ผมมาพบผู้เยียวยา,หมอนัด
2302,ผมมาพบปะกับผู้เยียวยาวันนี้,หมอนัด
2303,ผมมาพบปะกับผู้เยียวยาวันนี้จะต้องรับการรักษา,หมอนัด
2304,ผมมาพบปะกับผู้เยียวยาวันนี้มารับยา,หมอนัด
2305,ผมมาพบปะกับผู้เยียวยาวันนี้มาฉีดยา,หมอนัด
2306,ผมมาพบปะกับผู้เยียวยา,หมอนัด
2307,ผมผู้เยียวยานัดหมายมาวันนี้,หมอนัด
2308,ผมผู้เยียวยานัดหมายมาวันนี้จะต้องรับการรักษา,หมอนัด
2309,ผมผู้เยียวยานัดหมายมาวันนี้มารับยา,หมอนัด
2310,ผมผู้เยียวยานัดหมายมาวันนี้มาฉีดยา,หมอนัด
2311,ผมผู้เยียวยานัดหมายมา,หมอนัด
2312,ผมผู้เยียวยานัดพบวันนี้,หมอนัด
2313,ผมผู้เยียวยานัดพบวันนี้จะต้องรับการรักษา,หมอนัด
2314,ผมผู้เยียวยานัดพบวันนี้มารับยา,หมอนัด
2315,ผมผู้เยียวยานัดพบวันนี้มาฉีดยา,หมอนัด
2316,ผมผู้เยียวยานัดพบ,หมอนัด
2317,ผมผู้รักษาโรคนัดพบวันนี้,หมอนัด
2318,ผมผู้รักษาโรคนัดพบวันนี้จะต้องรับการรักษา,หมอนัด
2319,ผมผู้รักษาโรคนัดพบวันนี้มารับยา,หมอนัด
2320,ผมผู้รักษาโรคนัดพบวันนี้มาฉีดยา,หมอนัด
2321,ผมผู้รักษาโรคนัดพบ,หมอนัด
2322,ผมมาพบปะกับผู้รักษาโรควันนี้,หมอนัด
2323,ผมมาพบปะกับผู้รักษาโรควันนี้จะต้องรับการรักษา,หมอนัด
2324,ผมมาพบปะกับผู้รักษาโรควันนี้มารับยา,หมอนัด
2325,ผมมาพบปะกับผู้รักษาโรควันนี้มาฉีดยา,หมอนัด
2326,ผมมาพบปะกับผู้รักษาโรค,หมอนัด
2327,ผมผู้รักษาโรคเรียกมาวันนี้,หมอนัด
2328,ผมผู้รักษาโรคเรียกมาวันนี้จะต้องรับการรักษา,หมอนัด
2329,ผมผู้รักษาโรคเรียกมาวันนี้มารับยา,หมอนัด
2330,ผมผู้รักษาโรคเรียกมาวันนี้มาฉีดยา,หมอนัด
2331,ผมผู้รักษาโรคเรียกมา,หมอนัด
2332,ผมผู้รักษาโรคนัดหมายมาวันนี้,หมอนัด
2333,ผมผู้รักษาโรคนัดหมายมาวันนี้จะต้องรับการรักษา,หมอนัด
2334,ผมผู้รักษาโรคนัดหมายมาวันนี้มารับยา,หมอนัด
2335,ผมผู้รักษาโรคนัดหมายมาวันนี้มาฉีดยา,หมอนัด
2336,ผมผู้รักษาโรคนัดหมายมา,หมอนัด
2337,ผมผู้รักษาโรคนัดมาวันนี้,หมอนัด
2338,ผมผู้รักษาโรคนัดมาวันนี้จะต้องรับการรักษา,หมอนัด
2339,ผมผู้รักษาโรคนัดมาวันนี้มารับยา,หมอนัด
2340,ผมผู้รักษาโรคนัดมาวันนี้มาฉีดยา,หมอนัด
2341,ผมผู้รักษาโรคนัดมา,หมอนัด
2342,ผมผู้รักษาโรคนัดวันนี้,หมอนัด
2343,ผมผู้รักษาโรคนัดวันนี้จะต้องรับการรักษา,หมอนัด
2344,ผมผู้รักษาโรคนัดวันนี้มารับยา,หมอนัด
2345,ผมผู้รักษาโรคนัดวันนี้มาฉีดยา,หมอนัด
2346,ผมผู้รักษาโรคนัด,หมอนัด
2347,ผมมาพบผู้รักษาโรควันนี้,หมอนัด
2348,ผมมาพบผู้รักษาโรควันนี้จะต้องรับการรักษา,หมอนัด
2349,ผมมาพบผู้รักษาโรควันนี้มารับยา,หมอนัด
2350,ผมมาพบผู้รักษาโรควันนี้มาฉีดยา,หมอนัด
2351,ผมมาพบผู้รักษาโรค,หมอนัด
2352,ผมผู้รักษาโรคขอพบวันนี้,หมอนัด
2353,ผมผู้รักษาโรคขอพบวันนี้จะต้องรับการรักษา,หมอนัด
2354,ผมผู้รักษาโรคขอพบวันนี้มารับยา,หมอนัด
2355,ผมผู้รักษาโรคขอพบวันนี้มาฉีดยา,หมอนัด
2356,ผมผู้รักษาโรคขอพบ,หมอนัด
2357,ผมป่วยหมอนัด,หมอนัด
2358,หมอนัดผมมาครับ,หมอนัด
2359,หมอนัดให้มาวันนี้,หมอนัด
2360,หมอนัดมาโรงพยาบาลวันนี้ครับ,หมอนัด
2361,ผมป่วยแพทย์นัด,หมอนัด
2362,แพทย์นัดผมมาครับ,หมอนัด
2363,แพทย์นัดให้มาวันนี้,หมอนัด
2364,แพทย์นัดมาโรงพยาบาลวันนี้ครับ,หมอนัด
2365,วันนี้ผมมาหาหมอวันนี้,หมอนัด
2366,วันนี้ผมมาหาหมอวันนี้จะต้องรับการรักษา,หมอนัด
2367,วันนี้ผมมาหาหมอวันนี้มารับยา,หมอนัด
2368,วันนี้ผมมาหาหมอวันนี้มาฉีดยา,หมอนัด
2369,วันนี้ผมมาหาหมอ,หมอนัด
2370,วันนี้ผมหมอนัดวันนี้,หมอนัด
2371,วันนี้ผมหมอนัดวันนี้จะต้องรับการรักษา,หมอนัด
2372,วันนี้ผมหมอนัดวันนี้มารับยา,หมอนัด
2373,วันนี้ผมหมอนัดวันนี้มาฉีดยา,หมอนัด
2374,วันนี้ผมหมอนัด,หมอนัด
2375,วันนี้ผมหมอเรียกมาวันนี้,หมอนัด
2376,วันนี้ผมหมอเรียกมาวันนี้จะต้องรับการรักษา,หมอนัด
2377,วันนี้ผมหมอเรียกมาวันนี้มารับยา,หมอนัด
2378,วันนี้ผมหมอเรียกมาวันนี้มาฉีดยา,หมอนัด
2379,วันนี้ผมหมอเรียกมา,หมอนัด
2380,วันนี้ผมมาพบหมอวันนี้,หมอนัด
2381,วันนี้ผมมาพบหมอวันนี้จะต้องรับการรักษา,หมอนัด
2382,วันนี้ผมมาพบหมอวันนี้มารับยา,หมอนัด
2383,วันนี้ผมมาพบหมอวันนี้มาฉีดยา,หมอนัด
2384,วันนี้ผมมาพบหมอ,หมอนัด
2385,วันนี้ผมมาพบปะกับหมอวันนี้,หมอนัด
2386,วันนี้ผมมาพบปะกับหมอวันนี้จะต้องรับการรักษา,หมอนัด
2387,วันนี้ผมมาพบปะกับหมอวันนี้มารับยา,หมอนัด
2388,วันนี้ผมมาพบปะกับหมอวันนี้มาฉีดยา,หมอนัด
2389,วันนี้ผมมาพบปะกับหมอ,หมอนัด
2390,วันนี้ผมหมอนัดหมายมาวันนี้,หมอนัด
2391,วันนี้ผมหมอนัดหมายมาวันนี้จะต้องรับการรักษา,หมอนัด
2392,วันนี้ผมหมอนัดหมายมาวันนี้มารับยา,หมอนัด
2393,วันนี้ผมหมอนัดหมายมาวันนี้มาฉีดยา,หมอนัด
2394,วันนี้ผมหมอนัดหมายมา,หมอนัด
2395,วันนี้ผมหมอนัดพบวันนี้,หมอนัด
2396,วันนี้ผมหมอนัดพบวันนี้จะต้องรับการรักษา,หมอนัด
2397,วันนี้ผมหมอนัดพบวันนี้มารับยา,หมอนัด
2398,วันนี้ผมหมอนัดพบวันนี้มาฉีดยา,หมอนัด
2399,วันนี้ผมหมอนัดพบ,หมอนัด
2400,วันนี้ผมแพทย์นัดพบวันนี้,หมอนัด
2401,วันนี้ผมแพทย์นัดพบวันนี้จะต้องรับการรักษา,หมอนัด
2402,มีอาการปวดหัว,ป่วย
2403,มีอาการตัวร้อน,ป่วย
2404,มีอาการมีไข้,ป่วย
2405,มีอาการป่วย,ป่วย
2406,มีอาการท้องเสีย,ป่วย
2407,มีอาการเจ็บตามร่างกาย,ป่วย
2408,มีอาการเจ็บปวดตามร่างกาย,ป่วย
