ID,Data_Text,Result
1645,ตอนนี้ฉันมาให้น้ำเลือด,บริจาคเลือด
1646,ตอนนี้ฉันมาให้เลือดแดง,บริจาคเลือด
1647,ตอนนี้ฉันมาให้เลือดโลหิต,บริจาคเลือด
1648,ตอนนี้ฉันมาให้เกล็ดพลาสมา,บริจาคเลือด
1649,ตอนนี้ฉันมาให้เลือดพลาสมา,บริจาคเลือด
1650,ตอนนี้ฉันให้เลือด,บริจาคเลือด
1651,ตอนนี้ฉันให้โลหิต,บริจาคเลือด
1652,ตอนนี้ฉันให้เม็ดเลือด,บริจาคเลือด
1653,ตอนนี้ฉันให้เม็ดโลหิต,บริจาคเลือด
1654,ตอนนี้ฉันให้เกล็ดเลือด,บริจาคเลือด
1655,ตอนนี้ฉันให้เกล็ดโลหิต,บริจาคเลือด
1656,ตอนนี้ฉันให้เม็ดเลือดแดง,บริจาคเลือด
1657,ตอนนี้ฉันให้เม็ดโลหิต,บริจาคเลือด
1658,ตอนนี้ฉันให้พลาสมา,บริจาคเลือด
1659,ตอนนี้ฉันให้น้ำพลาสมา,บริจาคเลือด
1660,ตอนนี้ฉันให้น้ำโลหิต,บริจาคเลือด
1661,ตอนนี้ฉันให้น้ำเลือด,บริจาคเลือด
1662,ตอนนี้ฉันให้เลือดแดง,บริจาคเลือด
1663,ตอนนี้ฉันให้เลือดโลหิต,บริจาคเลือด
1664,ตอนนี้ฉันให้เกล็ดพลาสมา,บริจาคเลือด
1665,ตอนนี้ฉันให้เลือดพลาสมา,บริจาคเลือด
1666,ตอนนี้ฉันแบ่งเลือด,บริจาคเลือด
1667,ตอนนี้ฉันแบ่งโลหิต,บริจาคเลือด
1668,ตอนนี้ฉันแบ่งเม็ดเลือด,บริจาคเลือด
1669,ตอนนี้ฉันแบ่งเม็ดโลหิต,บริจาคเลือด
1670,ตอนนี้ฉันแบ่งเกล็ดเลือด,บริจาคเลือด
1671,ตอนนี้ฉันแบ่งเกล็ดโลหิต,บริจาคเลือด
1672,ตอนนี้ฉันแบ่งเม็ดเลือดแดง,บริจาคเลือด
1673,ตอนนี้ฉันแบ่งเม็ดโลหิต,บริจาคเลือด
1674,ตอนนี้ฉันแบ่งพลาสมา,บริจาคเลือด
1675,ตอนนี้ฉันแบ่งน้ำพลาสมา,บริจาคเลือด
1676,ตอนนี้ฉันแบ่งน้ำโลหิต,บริจาคเลือด
1677,ตอนนี้ฉันแบ่งน้ำเลือด,บริจาคเลือด
1678,ตอนนี้ฉันแบ่งเลือดแดง,บริจาคเลือด
1679,ตอนนี้ฉันแบ่งเลือดโลหิต,บริจาคเลือด
1680,ตอนนี้ฉันแบ่งเกล็ดพลาสมา,บริจาคเลือด
1681,ตอนนี้ฉันแบ่งเลือดพลาสมา,บริจาคเลือด
1682,ดิฉันมาบริจาคเลือด,บริจาคเลือด
1683,ดิฉันมาบริจาคโลหิต,บริจาคเลือด
1684,ดิฉันมาบริจาคเม็ดเลือด,บริจาคเลือด
1685,ดิฉันมาบริจาคเม็ดโลหิต,บริจาคเลือด
1686,ดิฉันมาบริจาคเกล็ดเลือด,บริจาคเลือด
1687,ดิฉันมาบริจาคเกล็ดโลหิต,บริจาคเลือด
1688,ดิฉันมาบริจาคเม็ดเลือดแดง,บริจาคเลือด
1689,ดิฉันมาบริจาคเม็ดโลหิต,บริจาคเลือด
1690,ดิฉันมาบริจาคพลาสมา,บริจาคเลือด
1691,ดิฉันมาบริจาคน้ำพลาสมา,บริจาคเลือด
1692,ดิฉันมาบริจาคน้ำโลหิต,บริจาคเลือด
1693,ดิฉันมาบริจาคน้ำเลือด,บริจาคเลือด
1694,ดิฉันมาบริจาคเลือดแดง,บริจาคเลือด
1695,ดิฉันมาบริจาคเลือดโลหิต,บริจาคเลือด
1696,ดิฉันมาบริจาคเกล็ดพลาสมา,บริจาคเลือด
1697,ดิฉันมาบริจาคเลือดพลาสมา,บริจาคเลือด
1698,ดิฉันบริจาคเลือด,บริจาคเลือด
1699,ดิฉันบริจาคโลหิต,บริจาคเลือด
1700,ดิฉันบริจาคเม็ดเลือด,บริจาคเลือด
1701,ดิฉันบริจาคเม็ดโลหิต,บริจาคเลือด
1702,ดิฉันบริจาคเกล็ดเลือด,บริจาคเลือด
1703,ดิฉันบริจาคเกล็ดโลหิต,บริจาคเลือด
1704,ดิฉันบริจาคเม็ดเลือดแดง,บริจาคเลือด
1705,ดิฉันบริจาคเม็ดโลหิต,บริจาคเลือด
1706,ดิฉันบริจาคพลาสมา,บริจาคเลือด
1707,ดิฉันบริจาคน้ำพลาสมา,บริจาคเลือด
1708,ดิฉันบริจาคน้ำโลหิต,บริจาคเลือด
1709,ดิฉันบริจาคน้ำเลือด,บริจาคเลือด
1710,ดิฉันบริจาคเลือดแดง,บริจาคเลือด
1711,ดิฉันบริจาคเลือดโลหิต,บริจาคเลือด
1712,ดิฉันบริจาคเกล็ดพลาสมา,บริจาคเลือด
1713,ดิฉันบริจาคเลือดพลาสมา,บริจาคเลือด
1714,ดิฉันมาให้เลือด,บริจาคเลือด
1715,ดิฉันมาให้โลหิต,บริจาคเลือด
1716,ดิฉันมาให้เม็ดเลือด,บริจาคเลือด
1717,ดิฉันมาให้เม็ดโลหิต,บริจาคเลือด
1718,ดิฉันมาให้เกล็ดเลือด,บริจาคเลือด
1719,ดิฉันมาให้เกล็ดโลหิต,บริจาคเลือด
1720,ดิฉันมาให้เม็ดเลือดแดง,บริจาคเลือด
1721,ดิฉันมาให้เม็ดโลหิต,บริจาคเลือด
1722,ดิฉันมาให้พลาสมา,บริจาคเลือด
1723,ดิฉันมาให้น้ำพลาสมา,บริจาคเลือด
1724,ดิฉันมาให้น้ำโลหิต,บริจาคเลือด
1725,ดิฉันมาให้น้ำเลือด,บริจาคเลือด
1726,ดิฉันมาให้เลือดแดง,บริจาคเลือด
1727,ดิฉันมาให้เลือดโลหิต,บริจาคเลือด
1728,ดิฉันมาให้เกล็ดพลาสมา,บริจาคเลือด
1729,ดิฉันมาให้เลือดพลาสมา,บริจาคเลือด
1730,ดิฉันให้เลือด,บริจาคเลือด
1731,ดิฉันให้โลหิต,บริจาคเลือด
1732,ดิฉันให้เม็ดเลือด,บริจาคเลือด
1733,ดิฉันให้เม็ดโลหิต,บริจาคเลือด
1734,ดิฉันให้เกล็ดเลือด,บริจาคเลือด
1735,ดิฉันให้เกล็ดโลหิต,บริจาคเลือด
1736,ดิฉันให้เม็ดเลือดแดง,บริจาคเลือด
1737,ดิฉันให้เม็ดโลหิต,บริจาคเลือด
1738,ดิฉันให้พลาสมา,บริจาคเลือด
1739,ดิฉันให้น้ำพลาสมา,บริจาคเลือด
1740,ดิฉันให้น้ำโลหิต,บริจาคเลือด
1741,ดิฉันให้น้ำเลือด,บริจาคเลือด
1742,ดิฉันให้เลือดแดง,บริจาคเลือด
1743,ดิฉันให้เลือดโลหิต,บริจาคเลือด
1744,ดิฉันให้เกล็ดพลาสมา,บริจาคเลือด
1745,ดิฉันให้เลือดพลาสมา,บริจาคเลือด
1746,ดิฉันแบ่งเลือด,บริจาคเลือด
1747,ดิฉันแบ่งโลหิต,บริจาคเลือด
1748,ดิฉันแบ่งเม็ดเลือด,บริจาคเลือด
1749,ดิฉันแบ่งเม็ดโลหิต,บริจาคเลือด
1750,ดิฉันแบ่งเกล็ดเลือด,บริจาคเลือด
1751,ดิฉันแบ่งเกล็ดโลหิต,บริจาคเลือด
1752,ดิฉันแบ่งเม็ดเลือดแดง,บริจาคเลือด
1753,ดิฉันแบ่งเม็ดโลหิต,บริจาคเลือด
1754,ดิฉันแบ่งพลาสมา,บริจาคเลือด
1755,ดิฉันแบ่งน้ำพลาสมา,บริจาคเลือด
1756,ดิฉันแบ่งน้ำโลหิต,บริจาคเลือด
1757,ดิฉันแบ่งน้ำเลือด,บริจาคเลือด
1758,ดิฉันแบ่งเลือดแดง,บริจาคเลือด
1759,ดิฉันแบ่งเลือดโลหิต,บริจาคเลือด
1760,ดิฉันแบ่งเกล็ดพลาสมา,บริจาคเลือด
1761,ดิฉันแบ่งเลือดพลาสมา,บริจาคเลือด
1762,เรามาบริจาคเลือด,บริจาคเลือด
1763,เรามาบริจาคโลหิต,บริจาคเลือด
1764,เรามาบริจาคเม็ดเลือด,บริจาคเลือด
1765,เรามาบริจาคเม็ดโลหิต,บริจาคเลือด
1766,เรามาบริจาคเกล็ดเลือด,บริจาคเลือด
1767,เรามาบริจาคเกล็ดโลหิต,บริจาคเลือด
1768,เรามาบริจาคเม็ดเลือดแดง,บริจาคเลือด
1769,เรามาบริจาคเม็ดโลหิต,บริจาคเลือด
1770,เรามาบริจาคพลาสมา,บริจาคเลือด
1771,เรามาบริจาคน้ำพลาสมา,บริจาคเลือด
1772,เรามาบริจาคน้ำโลหิต,บริจาคเลือด
1773,เรามาบริจาคน้ำเลือด,บริจาคเลือด
1774,เรามาบริจาคเลือดแดง,บริจาคเลือด
1775,เรามาบริจาคเลือดโลหิต,บริจาคเลือด
1776,เรามาบริจาคเกล็ดพลาสมา,บริจาคเลือด
1777,เรามาบริจาคเลือดพลาสมา,บริจาคเลือด
1778,เราบริจาคเลือด,บริจาคเลือด
1779,เราบริจาคโลหิต,บริจาคเลือด
1780,เราบริจาคเม็ดเลือด,บริจาคเลือด
1781,เราบริจาคเม็ดโลหิต,บริจาคเลือด
1782,เราบริจาคเกล็ดเลือด,บริจาคเลือด
1783,เราบริจาคเกล็ดโลหิต,บริจาคเลือด
1784,เราบริจาคเม็ดเลือดแดง,บริจาคเลือด
1785,เราบริจาคเม็ดโลหิต,บริจาคเลือด
1786,เราบริจาคพลาสมา,บริจาคเลือด
1787,เราบริจาคน้ำพลาสมา,บริจาคเลือด
1788,เราบริจาคน้ำโลหิต,บริจาคเลือด
1789,เราบริจาคน้ำเลือด,บริจาคเลือด
1790,เราบริจาคเลือดแดง,บริจาคเลือด
1791,เราบริจาคเลือดโลหิต,บริจาคเลือด
1792,เราบริจาคเกล็ดพลาสมา,บริจาคเลือด
1793,เราบริจาคเลือดพลาสมา,บริจาคเลือด
1794,เรามาให้เลือด,บริจาคเลือด
1795,เรามาให้โลหิต,บริจาคเลือด
1796,เรามาให้เม็ดเลือด,บริจาคเลือด
1797,เรามาให้เม็ดโลหิต,บริจาคเลือด
1798,เรามาให้เกล็ดเลือด,บริจาคเลือด
1799,เรามาให้เกล็ดโลหิต,บริจาคเลือด
1800,เรามาให้เม็ดเลือดแดง,บริจาคเลือด
1801,เรามาให้เม็ดโลหิต,บริจาคเลือด
1802,ผมมาหาหมอวันนี้,หมอนัด
1803,ผมมาหาหมอวันนี้จะต้องรับการรักษา,หมอนัด
1804,ผมมาหาหมอวันนี้มารับยา,หมอนัด
1805,ผมมาหาหมอวันนี้มาฉีดยา,หมอนัด
1806,ผมมาหาหมอ,หมอนัด
1807,ผมหมอนัดวันนี้,หมอนัด
1808,ผมหมอนัดวันนี้จะต้องรับการรักษา,หมอนัด
1809,ผมหมอนัดวันนี้มารับยา,หมอนัด
1810,ผมหมอนัดวันนี้มาฉีดยา,หมอนัด
1811,ผมหมอนัด,หมอนัด
1812,ผมหมอเรียกมาวันนี้,หมอนัด
1813,ผมหมอเรียกมาวันนี้จะต้องรับการรักษา,หมอนัด
1814,ผมหมอเรียกมาวันนี้มารับยา,หมอนัด
1815,ผมหมอเรียกมาวันนี้มาฉีดยา,หมอนัด
1816,ผมหมอเรียกมา,หมอนัด
1817,ผมมาพบหมอวันนี้,หมอนัด
1818,ผมมาพบหมอวันนี้จะต้องรับการรักษา,หมอนัด
1819,ผมมาพบหมอวันนี้มารับยา,หมอนัด
1820,ผมมาพบหมอวันนี้มาฉีดยา,หมอนัด
1821,ผมมาพบหมอ,หมอนัด
1822,ผมมาพบปะกับหมอวันนี้,หมอนัด
1823,ผมมาพบปะกับหมอวันนี้จะต้องรับการรักษา,หมอนัด
1824,ผมมาพบปะกับหมอวันนี้มารับยา,หมอนัด
1825,ผมมาพบปะกับหมอวันนี้มาฉีดยา,หมอนัด
1826,ผมมาพบปะกับหมอ,หมอนัด
1827,ผมหมอนัดหมายมาวันนี้,หมอนัด
1828,ผมหมอนัดหมายมาวันนี้จะต้องรับการรักษา,หมอนัด
1829,ผมหมอนัดหมายมาวันนี้มารับยา,หมอนัด
1830,ผมหมอนัดหมายมาวันนี้มาฉีดยา,หมอนัด
1831,ผมหมอนัดหมายมา,หมอนัด
1832,ผมหมอนัดพบวันนี้,หมอนัด
1833,ผมหมอนัดพบวันนี้จะต้องรับการรักษา,หมอนัด
1834,ผมหมอนัดพบวันนี้มารับยา,หมอนัด
1835,ผมหมอนัดพบวันนี้มาฉีดยา,หมอนัด
1836,ผมหมอนัดพบ,หมอนัด
1837,ผมแพทย์นัดพบวันนี้,หมอนัด
1838,ผมแพทย์นัดพบวันนี้จะต้องรับการรักษา,หมอนัด
1839,ผมแพทย์นัดพบวันนี้มารับยา,หมอนัด
1840,ผมแพทย์นัดพบวันนี้มาฉีดยา,หมอนัด
1841,ผมแพทย์นัดพบ,หมอนัด
1842,ผมมาพบปะกับแพทย์วันนี้,หมอนัด
1843,ผมมาพบปะกับแพทย์วันนี้จะต้องรับการรักษา,หมอนัด
1844,ผมมาพบปะกับแพทย์วันนี้มารับยา,หมอนัด
1845,ผมมาพบปะกับแพทย์วันนี้มาฉีดยา,หมอนัด
1846,ผมมาพบปะกับแพทย์,หมอนัด
1847,ผมแพทย์เรียกมาวันนี้,หมอนัด
1848,ผมแพทย์เรียกมาวันนี้จะต้องรับการรักษา,หมอนัด
1849,ผมแพทย์เรียกมาวันนี้มารับยา,หมอนัด
1850,ผมแพทย์เรียกมาวันนี้มาฉีดยา,หมอนัด
1851,ผมแพทย์เรียกมา,หมอนัด
1852,ผมแพทย์นัดหมายมาวันนี้,หมอนัด
1853,ผมแพทย์นัดหมายมาวันนี้จะต้องรับการรักษา,หมอนัด
1854,ผมแพทย์นัดหมายมาวันนี้มารับยา,หมอนัด
1855,ผมแพทย์นัดหมายมาวันนี้มาฉีดยา,หมอนัด
1856,ผมแพทย์นัดหมายมา,หมอนัด
1857,ผมแพทย์นัดมาวันนี้,หมอนัด
1858,ผมแพทย์นัดมาวันนี้จะต้องรับการรักษา,หมอนัด
1859,ผมแพทย์นัดมาวันนี้มารับยา,หมอนัด
1860,ผมแพทย์นัดมาวันนี้มาฉีดยา,หมอนัด
1861,ผมแพทย์นัดมา,หมอนัด
1862,ผมแพทย์นัดวันนี้,หมอนัด
1863,ผมแพทย์นัดวันนี้จะต้องรับการรักษา,หมอนัด
1864,ผมแพทย์นัดวันนี้มารับยา,หมอนัด
1865,ผมแพทย์นัดวันนี้มาฉีดยา,หมอนัด
1866,ผมแพทย์นัด,หมอนัด
1867,ผมมาพบแพทย์วันนี้,หมอนัด
1868,ผมมาพบแพทย์วันนี้จะต้องรับการรักษา,หมอนัด
1869,ผมมาพบแพทย์วันนี้มารับยา,หมอนัด
1870,ผมมาพบแพทย์วันนี้มาฉีดยา,หมอนัด
1871,ผมมาพบแพทย์,หมอนัด
1872,ผมแพทย์ขอพบวันนี้,หมอนัด
1873,ผมแพทย์ขอพบวันนี้จะต้องรับการรักษา,หมอนัด
1874,ผมแพทย์ขอพบวันนี้มารับยา,หมอนัด
1875,ผมแพทย์ขอพบวันนี้มาฉีดยา,หมอนัด
1876,ผมแพทย์ขอพบ,หมอนัด
1877,ผมมาหาผู้รักษาวันนี้,หมอนัด
1878,ผมมาหาผู้รักษาวันนี้จะต้องรับการรักษา,หมอนัด
1879,ผมมาหาผู้รักษาวันนี้มารับยา,หมอนัด
1880,ผมมาหาผู้รักษาวันนี้มาฉีดยา,หมอนัด
1881,ผมมาหาผู้รักษา,หมอนัด
1882,ผมผู้รักษานัดวันนี้,หมอนัด
1883,ผมผู้รักษานัดวันนี้จะต้องรับการรักษา,หมอนัด
1884,ผมผู้รักษานัดวันนี้มารับยา,หมอนัด
1885,ผมผู้รักษานัดวันนี้มาฉีดยา,หมอนัด
1886,ผมผู้รักษานัด,หมอนัด
1887,ผมผู้รักษาเรียกมาวันนี้,หมอนัด
1888,ผมผู้รักษาเรียกมาวันนี้จะต้องรับการรักษา,หมอนัด
1889,ผมผู้รักษาเรียกมาวันนี้มารับยา,หมอนัด
1890,ผมผู้รักษาเรียกมาวันนี้มาฉีดยา,หมอนัด
1891,ผมผู้รักษาเรียกมา,หมอนัด
1892,ผมมาพบผู้รักษาวันนี้,หมอนัด
1893,ผมมาพบผู้รักษาวันนี้จะต้องรับการรักษา,หมอนัด
1894,ผมมาพบผู้รักษาวันนี้มารับยา,หมอนัด
1895,ผมมาพบผู้รักษาวันนี้มาฉีดยา,หมอนัด
1896,ผมมาพบผู้รักษา,หมอนัด
1897,ผมมาพบปะกับผู้รักษาวันนี้,หมอนัด
1898,ผมมาพบปะกับผู้รักษาวันนี้จะต้องรับการรักษา,หมอนัด
1899,ผมมาพบปะกับผู้รักษาวันนี้มารับยา,หมอนัด
1900,ผมมาพบปะกับผู้รักษาวันนี้มาฉีดยา,หมอนัด
1901,ผมมาพบปะกับผู้รักษา,หมอนัด
1902,ผมผู้รักษานัดหมายมาวันนี้,หมอนัด
1903,ผมผู้รักษานัดหมายมาวันนี้จะต้องรับการรักษา,หมอนัด
1904,ผมผู้รักษานัดหมายมาวันนี้มารับยา,หมอนัด
1905,ผมผู้รักษานัดหมายมาวันนี้มาฉีดยา,หมอนัด
1906,ผมผู้รักษานัดหมายมา,หมอนัด
1907,ผมผู้รักษานัดพบวันนี้,หมอนัด
