ID,Data_Text,Result
1,วันนี้ผมมาตรวจสุขภาพ,ตรวจสุขภาพ
2,ผมมาตรวจร่างกายคับ,ตรวจสุขภาพ
3,มาตรวจสุขภาพร่างกาย,ตรวจสุขภาพ
4,ตรวจสุขภาพร่างกาย,ตรวจสุขภาพ
5,มาเช็คสุขภาพร่างกายครับ,ตรวจสุขภาพ
6,มาตรวจสุขภาพ,ตรวจสุขภาพ
7,มาตรวจร่างกาย,ตรวจสุขภาพ
8,มาตรวจสุขภาพร่างกาย,ตรวจสุขภาพ
9,มาตรวจการทำงานในร่างกาย,ตรวจสุขภาพ
10,มาตรวจระบบในร่างกาย,ตรวจสุขภาพ
11,มาตรวจการทำงานของร่างกาย,ตรวจสุขภาพ
12,มาตรวจระบบการทำงานของร่างกาย,ตรวจสุขภาพ
13,มาตรวจระบบภายใน,ตรวจสุขภาพ
14,มาตรวจภายในร่างกาย,ตรวจสุขภาพ
15,มาตรวจระบบภายในร่างกาย,ตรวจสุขภาพ
16,มาตรวจภายใน,ตรวจสุขภาพ
17,มาตรวจลักษณะร่างกาย,ตรวจสุขภาพ
18,มาตรวจคุณภาพร่างกาย,ตรวจสุขภาพ
19,มาตรวจคุณภาพระบบร่างกาย,ตรวจสุขภาพ
20,ตรวจสุขภาพ,ตรวจสุขภาพ
21,ตรวจร่างกาย,ตรวจสุขภาพ
22,ตรวจสุขภาพร่างกาย,ตรวจสุขภาพ
23,ตรวจการทำงานในร่างกาย,ตรวจสุขภาพ
24,ตรวจระบบในร่างกาย,ตรวจสุขภาพ
25,ตรวจการทำงานของร่างกาย,ตรวจสุขภาพ
26,ตรวจระบบการทำงานของร่างกาย,ตรวจสุขภาพ
27,ตรวจระบบภายใน,ตรวจสุขภาพ
28,ตรวจภายในร่างกาย,ตรวจสุขภาพ
29,ตรวจระบบภายในร่างกาย,ตรวจสุขภาพ
30,ตรวจภายใน,ตรวจสุขภาพ
31,ตรวจลักษณะร่างกาย,ตรวจสุขภาพ
32,ตรวจคุณภาพร่างกาย,ตรวจสุขภาพ
33,ตรวจคุณภาพระบบร่างกาย,ตรวจสุขภาพ
34,เช็คสุขภาพ,ตรวจสุขภาพ
35,เช็คร่างกาย,ตรวจสุขภาพ
36,เช็คสุขภาพร่างกาย,ตรวจสุขภาพ
37,เช็คการทำงานในร่างกาย,ตรวจสุขภาพ
38,เช็คระบบในร่างกาย,ตรวจสุขภาพ
39,เช็คการทำงานของร่างกาย,ตรวจสุขภาพ
40,เช็คระบบการทำงานของร่างกาย,ตรวจสุขภาพ
41,เช็คระบบภายใน,ตรวจสุขภาพ
42,เช็คภายในร่างกาย,ตรวจสุขภาพ
43,เช็คระบบภายในร่างกาย,ตรวจสุขภาพ
44,เช็คภายใน,ตรวจสุขภาพ
45,เช็คลักษณะร่างกาย,ตรวจสุขภาพ
46,เช็คคุณภาพร่างกาย,ตรวจสุขภาพ
47,เช็คคุณภาพระบบร่างกาย,ตรวจสุขภาพ
48,มาเช็คสุขภาพ,ตรวจสุขภาพ
49,มาเช็คร่างกาย,ตรวจสุขภาพ
50,มาเช็คสุขภาพร่างกาย,ตรวจสุขภาพ
51,มาเช็คการทำงานในร่างกาย,ตรวจสุขภาพ
52,มาเช็คระบบในร่างกาย,ตรวจสุขภาพ
53,มาเช็คการทำงานของร่างกาย,ตรวจสุขภาพ
54,มาเช็คระบบการทำงานของร่างกาย,ตรวจสุขภาพ
55,มาเช็คระบบภายใน,ตรวจสุขภาพ
56,มาเช็คภายในร่างกาย,ตรวจสุขภาพ
57,มาเช็คระบบภายในร่างกาย,ตรวจสุขภาพ
58,มาเช็คภายใน,ตรวจสุขภาพ
59,มาเช็คลักษณะร่างกาย,ตรวจสุขภาพ
60,มาเช็คคุณภาพร่างกาย,ตรวจสุขภาพ
61,มาเช็คคุณภาพระบบร่างกาย,ตรวจสุขภาพ
62,ตรวจสอบสุขภาพ,ตรวจสุขภาพ
63,ตรวจสอบร่างกาย,ตรวจสุขภาพ
64,ตรวจสอบสุขภาพร่างกาย,ตรวจสุขภาพ
65,ตรวจสอบการทำงานในร่างกาย,ตรวจสุขภาพ
66,ตรวจสอบระบบในร่างกาย,ตรวจสุขภาพ
67,ตรวจสอบการทำงานของร่างกาย,ตรวจสุขภาพ
68,ตรวจสอบระบบการทำงานของร่างกาย,ตรวจสุขภาพ
69,ตรวจสอบระบบภายใน,ตรวจสุขภาพ
70,ตรวจสอบภายในร่างกาย,ตรวจสุขภาพ
71,ตรวจสอบระบบภายในร่างกาย,ตรวจสุขภาพ
72,ตรวจสอบภายใน,ตรวจสุขภาพ
73,ตรวจสอบลักษณะร่างกาย,ตรวจสุขภาพ
74,ตรวจสอบคุณภาพร่างกาย,ตรวจสุขภาพ
75,ตรวจสอบคุณภาพระบบร่างกาย,ตรวจสุขภาพ
76,วิเคราะห์สุขภาพ,ตรวจสุขภาพ
77,วิเคราะห์ร่างกาย,ตรวจสุขภาพ
78,วิเคราะห์สุขภาพร่างกาย,ตรวจสุขภาพ
79,วิเคราะห์การทำงานในร่างกาย,ตรวจสุขภาพ
80,วิเคราะห์ระบบในร่างกาย,ตรวจสุขภาพ
81,วิเคราะห์การทำงานของร่างกาย,ตรวจสุขภาพ
82,วิเคราะห์ระบบการทำงานของร่างกาย,ตรวจสุขภาพ
83,วิเคราะห์ระบบภายใน,ตรวจสุขภาพ
84,วิเคราะห์ภายในร่างกาย,ตรวจสุขภาพ
85,วิเคราะห์ระบบภายในร่างกาย,ตรวจสุขภาพ
86,วิเคราะห์ภายใน,ตรวจสุขภาพ
87,วิเคราะห์ลักษณะร่างกาย,ตรวจสุขภาพ
88,วิเคราะห์คุณภาพร่างกาย,ตรวจสุขภาพ
89,วิเคราะห์คุณภาพระบบร่างกาย,ตรวจสุขภาพ
90,เช็คตรวจสอบสุขภาพ,ตรวจสุขภาพ
91,เช็คตรวจสอบร่างกาย,ตรวจสุขภาพ
92,เช็คตรวจสอบสุขภาพร่างกาย,ตรวจสุขภาพ
93,เช็คตรวจสอบการทำงานในร่างกาย,ตรวจสุขภาพ
94,เช็คตรวจสอบระบบในร่างกาย,ตรวจสุขภาพ
95,เช็คตรวจสอบการทำงานของร่างกาย,ตรวจสุขภาพ
96,เช็คตรวจสอบระบบการทำงานของร่างกาย,ตรวจสุขภาพ
97,เช็คตรวจสอบระบบภายใน,ตรวจสุขภาพ
98,เช็คตรวจสอบภายในร่างกาย,ตรวจสุขภาพ
99,เช็คตรวจสอบระบบภายในร่างกาย,ตรวจสุขภาพ
100,เช็คตรวจสอบภายใน,ตรวจสุขภาพ
101,เช็คตรวจสอบลักษณะร่างกาย,ตรวจสุขภาพ
102,เช็คตรวจสอบคุณภาพร่างกาย,ตรวจสุขภาพ
103,เช็คตรวจสอบคุณภาพระบบร่างกาย,ตรวจสุขภาพ
104,วันนี้มาตรวจสุขภาพร่างกาย,ตรวจสุขภาพ
105,วันนี้มาตรวจสุขภาพ,ตรวจสุขภาพ
106,วันนี้มาตรวจร่างกาย,ตรวจสุขภาพ
107,วันนี้มาตรวจสุขภาพร่างกาย,ตรวจสุขภาพ
108,วันนี้มาตรวจการทำงานในร่างกาย,ตรวจสุขภาพ
109,วันนี้มาตรวจระบบในร่างกาย,ตรวจสุขภาพ
110,วันนี้มาตรวจการทำงานของร่างกาย,ตรวจสุขภาพ
111,วันนี้มาตรวจระบบการทำงานของร่างกาย,ตรวจสุขภาพ
112,วันนี้มาตรวจระบบภายใน,ตรวจสุขภาพ
113,วันนี้มาตรวจภายในร่างกาย,ตรวจสุขภาพ
114,วันนี้มาตรวจระบบภายในร่างกาย,ตรวจสุขภาพ
115,วันนี้มาตรวจภายใน,ตรวจสุขภาพ
116,วันนี้มาตรวจลักษณะร่างกาย,ตรวจสุขภาพ
117,วันนี้มาตรวจคุณภาพร่างกาย,ตรวจสุขภาพ
118,วันนี้มาตรวจคุณภาพระบบร่างกาย,ตรวจสุขภาพ
119,วันนี้ตรวจสุขภาพ,ตรวจสุขภาพ
120,วันนี้ตรวจร่างกาย,ตรวจสุขภาพ
121,วันนี้ตรวจสุขภาพร่างกาย,ตรวจสุขภาพ
122,วันนี้ตรวจการทำงานในร่างกาย,ตรวจสุขภาพ
123,วันนี้ตรวจระบบในร่างกาย,ตรวจสุขภาพ
124,วันนี้ตรวจการทำงานของร่างกาย,ตรวจสุขภาพ
125,วันนี้ตรวจระบบการทำงานของร่างกาย,ตรวจสุขภาพ
126,วันนี้ตรวจระบบภายใน,ตรวจสุขภาพ
127,วันนี้ตรวจภายในร่างกาย,ตรวจสุขภาพ
128,วันนี้ตรวจระบบภายในร่างกาย,ตรวจสุขภาพ
129,วันนี้ตรวจภายใน,ตรวจสุขภาพ
130,วันนี้ตรวจลักษณะร่างกาย,ตรวจสุขภาพ
131,วันนี้ตรวจคุณภาพร่างกาย,ตรวจสุขภาพ
132,วันนี้ตรวจคุณภาพระบบร่างกาย,ตรวจสุขภาพ
133,วันนี้เช็คสุขภาพ,ตรวจสุขภาพ
134,วันนี้เช็คร่างกาย,ตรวจสุขภาพ
135,วันนี้เช็คสุขภาพร่างกาย,ตรวจสุขภาพ
136,วันนี้เช็คการทำงานในร่างกาย,ตรวจสุขภาพ
137,วันนี้เช็คระบบในร่างกาย,ตรวจสุขภาพ
138,วันนี้เช็คการทำงานของร่างกาย,ตรวจสุขภาพ
139,วันนี้เช็คระบบการทำงานของร่างกาย,ตรวจสุขภาพ
140,วันนี้เช็คระบบภายใน,ตรวจสุขภาพ
141,วันนี้เช็คภายในร่างกาย,ตรวจสุขภาพ
142,วันนี้เช็คระบบภายในร่างกาย,ตรวจสุขภาพ
143,วันนี้เช็คภายใน,ตรวจสุขภาพ
144,วันนี้เช็คลักษณะร่างกาย,ตรวจสุขภาพ
145,วันนี้เช็คคุณภาพร่างกาย,ตรวจสุขภาพ
146,วันนี้เช็คคุณภาพระบบร่างกาย,ตรวจสุขภาพ
147,วันนี้มาเช็คสุขภาพ,ตรวจสุขภาพ
148,วันนี้มาเช็คร่างกาย,ตรวจสุขภาพ
149,วันนี้มาเช็คสุขภาพร่างกาย,ตรวจสุขภาพ
150,วันนี้มาเช็คการทำงานในร่างกาย,ตรวจสุขภาพ
151,วันนี้มาเช็คระบบในร่างกาย,ตรวจสุขภาพ
152,วันนี้มาเช็คการทำงานของร่างกาย,ตรวจสุขภาพ
153,วันนี้มาเช็คระบบการทำงานของร่างกาย,ตรวจสุขภาพ
154,วันนี้มาเช็คระบบภายใน,ตรวจสุขภาพ
155,วันนี้มาเช็คภายในร่างกาย,ตรวจสุขภาพ
156,วันนี้มาเช็คระบบภายในร่างกาย,ตรวจสุขภาพ
157,วันนี้มาเช็คภายใน,ตรวจสุขภาพ
158,วันนี้มาเช็คลักษณะร่างกาย,ตรวจสุขภาพ
159,วันนี้มาเช็คคุณภาพร่างกาย,ตรวจสุขภาพ
160,วันนี้มาเช็คคุณภาพระบบร่างกาย,ตรวจสุขภาพ
161,วันนี้ตรวจสอบสุขภาพ,ตรวจสุขภาพ
162,วันนี้ตรวจสอบร่างกาย,ตรวจสุขภาพ
163,วันนี้ตรวจสอบสุขภาพร่างกาย,ตรวจสุขภาพ
164,วันนี้ตรวจสอบการทำงานในร่างกาย,ตรวจสุขภาพ
165,วันนี้ตรวจสอบระบบในร่างกาย,ตรวจสุขภาพ
166,วันนี้ตรวจสอบการทำงานของร่างกาย,ตรวจสุขภาพ
167,วันนี้ตรวจสอบระบบการทำงานของร่างกาย,ตรวจสุขภาพ
168,วันนี้ตรวจสอบระบบภายใน,ตรวจสุขภาพ
169,วันนี้ตรวจสอบภายในร่างกาย,ตรวจสุขภาพ
170,วันนี้ตรวจสอบระบบภายในร่างกาย,ตรวจสุขภาพ
171,วันนี้ตรวจสอบภายใน,ตรวจสุขภาพ
172,วันนี้ตรวจสอบลักษณะร่างกาย,ตรวจสุขภาพ
173,วันนี้ตรวจสอบคุณภาพร่างกาย,ตรวจสุขภาพ
174,วันนี้ตรวจสอบคุณภาพระบบร่างกาย,ตรวจสุขภาพ
175,วันนี้วิเคราะห์สุขภาพ,ตรวจสุขภาพ
176,วันนี้วิเคราะห์ร่างกาย,ตรวจสุขภาพ
177,วันนี้วิเคราะห์สุขภาพร่างกาย,ตรวจสุขภาพ
178,วันนี้วิเคราะห์การทำงานในร่างกาย,ตรวจสุขภาพ
179,วันนี้วิเคราะห์ระบบในร่างกาย,ตรวจสุขภาพ
180,วันนี้วิเคราะห์การทำงานของร่างกาย,ตรวจสุขภาพ
181,วันนี้วิเคราะห์ระบบการทำงานของร่างกาย,ตรวจสุขภาพ
182,วันนี้วิเคราะห์ระบบภายใน,ตรวจสุขภาพ
183,วันนี้วิเคราะห์ภายในร่างกาย,ตรวจสุขภาพ
184,วันนี้วิเคราะห์ระบบภายในร่างกาย,ตรวจสุขภาพ
185,วันนี้วิเคราะห์ภายใน,ตรวจสุขภาพ
186,วันนี้วิเคราะห์ลักษณะร่างกาย,ตรวจสุขภาพ
187,วันนี้วิเคราะห์คุณภาพร่างกาย,ตรวจสุขภาพ
188,วันนี้วิเคราะห์คุณภาพระบบร่างกาย,ตรวจสุขภาพ
189,วันนี้เช็คตรวจสอบสุขภาพ,ตรวจสุขภาพ
190,วันนี้เช็คตรวจสอบร่างกาย,ตรวจสุขภาพ
191,วันนี้เช็คตรวจสอบสุขภาพร่างกาย,ตรวจสุขภาพ
192,วันนี้เช็คตรวจสอบการทำงานในร่างกาย,ตรวจสุขภาพ
193,วันนี้เช็คตรวจสอบระบบในร่างกาย,ตรวจสุขภาพ
194,วันนี้เช็คตรวจสอบการทำงานของร่างกาย,ตรวจสุขภาพ
195,วันนี้เช็คตรวจสอบระบบการทำงานของร่างกาย,ตรวจสุขภาพ
196,วันนี้เช็คตรวจสอบระบบภายใน,ตรวจสุขภาพ
197,วันนี้เช็คตรวจสอบภายในร่างกาย,ตรวจสุขภาพ
198,วันนี้เช็คตรวจสอบระบบภายในร่างกาย,ตรวจสุขภาพ
199,วันนี้เช็คตรวจสอบภายใน,ตรวจสุขภาพ
200,วันนี้เช็คตรวจสอบลักษณะร่างกาย,ตรวจสุขภาพ
201,วันนี้เช็คตรวจสอบคุณภาพร่างกาย,ตรวจสุขภาพ
202,วันนี้เช็คตรวจสอบคุณภาพระบบร่างกาย,ตรวจสุขภาพ
203,ผมมาตรวจสุขภาพ,ตรวจสุขภาพ
204,ผมมาตรวจร่างกาย,ตรวจสุขภาพ
205,ผมมาตรวจสุขภาพร่างกาย,ตรวจสุขภาพ
206,ผมมาตรวจการทำงานในร่างกาย,ตรวจสุขภาพ
207,ผมมาตรวจระบบในร่างกาย,ตรวจสุขภาพ
208,ผมมาตรวจการทำงานของร่างกาย,ตรวจสุขภาพ
209,ผมมาตรวจระบบการทำงานของร่างกาย,ตรวจสุขภาพ
210,ผมมาตรวจระบบภายใน,ตรวจสุขภาพ
211,ผมมาตรวจภายในร่างกาย,ตรวจสุขภาพ
212,ผมมาตรวจระบบภายในร่างกาย,ตรวจสุขภาพ
213,ผมมาตรวจภายใน,ตรวจสุขภาพ
214,ผมมาตรวจลักษณะร่างกาย,ตรวจสุขภาพ
215,ผมมาตรวจคุณภาพร่างกาย,ตรวจสุขภาพ
216,ผมมาตรวจคุณภาพระบบร่างกาย,ตรวจสุขภาพ
217,ผมตรวจสุขภาพ,ตรวจสุขภาพ
218,ผมตรวจร่างกาย,ตรวจสุขภาพ
219,ผมตรวจสุขภาพร่างกาย,ตรวจสุขภาพ
220,ผมตรวจการทำงานในร่างกาย,ตรวจสุขภาพ
221,ผมตรวจระบบในร่างกาย,ตรวจสุขภาพ
222,ผมตรวจการทำงานของร่างกาย,ตรวจสุขภาพ
223,ผมตรวจระบบการทำงานของร่างกาย,ตรวจสุขภาพ
224,ผมตรวจระบบภายใน,ตรวจสุขภาพ
225,ผมตรวจภายในร่างกาย,ตรวจสุขภาพ
226,ผมตรวจระบบภายในร่างกาย,ตรวจสุขภาพ
227,ผมตรวจภายใน,ตรวจสุขภาพ
228,ผมตรวจลักษณะร่างกาย,ตรวจสุขภาพ
229,ผมตรวจคุณภาพร่างกาย,ตรวจสุขภาพ
230,ผมตรวจคุณภาพระบบร่างกาย,ตรวจสุขภาพ
231,ผมเช็คสุขภาพ,ตรวจสุขภาพ
232,ผมเช็คร่างกาย,ตรวจสุขภาพ
233,ผมเช็คสุขภาพร่างกาย,ตรวจสุขภาพ
234,ผมเช็คการทำงานในร่างกาย,ตรวจสุขภาพ
235,ผมเช็คระบบในร่างกาย,ตรวจสุขภาพ
236,ผมเช็คการทำงานของร่างกาย,ตรวจสุขภาพ
237,ผมเช็คระบบการทำงานของร่างกาย,ตรวจสุขภาพ
238,ผมเช็คระบบภายใน,ตรวจสุขภาพ
239,ผมเช็คภายในร่างกาย,ตรวจสุขภาพ
240,ผมเช็คระบบภายในร่างกาย,ตรวจสุขภาพ
241,ผมเช็คภายใน,ตรวจสุขภาพ
242,ผมเช็คลักษณะร่างกาย,ตรวจสุขภาพ
243,ผมเช็คคุณภาพร่างกาย,ตรวจสุขภาพ
244,ผมเช็คคุณภาพระบบร่างกาย,ตรวจสุขภาพ
245,ผมมาเช็คสุขภาพ,ตรวจสุขภาพ
246,ผมมาเช็คร่างกาย,ตรวจสุขภาพ
247,ผมมาเช็คสุขภาพร่างกาย,ตรวจสุขภาพ
248,ผมมาเช็คการทำงานในร่างกาย,ตรวจสุขภาพ
249,ผมมาเช็คระบบในร่างกาย,ตรวจสุขภาพ
250,ผมมาเช็คการทำงานของร่างกาย,ตรวจสุขภาพ
251,ผมมาเช็คระบบการทำงานของร่างกาย,ตรวจสุขภาพ
252,ผมมาเช็คระบบภายใน,ตรวจสุขภาพ
253,ผมมาเช็คภายในร่างกาย,ตรวจสุขภาพ
